[
  {
    "id": "8",
    "type": "應記載",
    "original": "承租人應以善良管理人之注意使用租賃住宅,除經出租人同意外,不得變更用途、轉租或將租賃住宅之一部或全部借予他人使用。承租人不得於租賃住宅內從事違法行為。",
    "plain": "你租房子要好好使用,不能隨便改用途(比如把住家變辦公室)、不能轉租給別人、不能借給朋友長住,除非房東同意。更不能在房子裡做違法的事。【AI起草,待驗收】",
    "violations": [
      {
        "pattern": "未經同意將住家轉租給他人",
        "example": "房客把15,000元/月的套房轉租給別人收20,000元,房東發現後可立即終止租約",
        "severity_flag": "高"
      },
      {
        "pattern": "改變租賃用途",
        "example": "租住家用途卻開民宿、當工作室營業,違反住宅使用規定",
        "severity_flag": "中"
      },
      {
        "pattern": "在租屋處從事違法行為",
        "example": "在租屋處經營賭博、販毒等違法活動,房東可立即終止租約並報警",
        "severity_flag": "高"
      },
      {
        "pattern": "未經同意借予他人長期居住",
        "example": "房客讓朋友長住超過2個月未告知房東,違反租約約定",
        "severity_flag": "中"
      }
    ],
    "severity": "中",
    "source_ver": "114年4月18日"
  },
  {
    "id": "9",
    "type": "應記載",
    "original": "租賃住宅或附屬設備損壞而有修繕必要時,應由出租人負責修繕。但租賃契約另有約定、習慣或可歸責於承租人之事由者,不在此限。前項由出租人負責修繕者,如出租人未於承租人所定相當期限內修繕時,承租人得自行修繕,並請求出租人償還其費用或於第四條之租金中扣除。",
    "plain": "房子或設備壞了要修,原則上房東要負責修(比如漏水、馬桶壞掉、冷氣故障)。如果房東收到通知後不修,你可以自己找人修,然後拿收據向房東要錢或從租金扣。但如果是你自己弄壞的(比如打破玻璃),就要自己負責修。【AI起草,待驗收】",
    "violations": [
      {
        "pattern": "房東完全不修繕且危害居住安全",
        "example": "屋頂漏水3個月未修,房客物品損失2萬元且牆壁發霉影響健康,房東仍拒絕修繕",
        "severity_flag": "高"
      },
      {
        "pattern": "房東將應負責的修繕推給房客",
        "example": "馬桶水箱故障(非人為損壞),房東要求房客自費修理花費3,500元",
        "severity_flag": "高"
      },
      {
        "pattern": "房東延遲修繕超過合理期限",
        "example": "冷氣故障通知後房東拖延45天才修,夏季期間房客無法正常使用",
        "severity_flag": "中"
      },
      {
        "pattern": "房東拒絕償還房客代墊修繕費",
        "example": "房客通知漏水未修,自行修繕花費8,000元並保留收據,房東拒絕償還",
        "severity_flag": "高"
      },
      {
        "pattern": "合約模糊修繕責任歸屬",
        "example": "合約寫「設備損壞由使用者負責」,未區分正常損耗或人為損壞,易產生爭議",
        "severity_flag": "中"
      }
    ],
    "severity": "高",
    "source_ver": "114年4月18日"
  },
  {
    "id": "10",
    "type": "應記載",
    "original": "出租人應提供租賃住宅及附屬設備之詳細清冊,並於簽約時與承租人共同確認點交。租賃關係終止時,承租人應依原狀返還租賃住宅及附屬設備,但合於下列情形者,不在此限:一、通常損耗。二、依約定得不為回復原狀。",
    "plain": "簽約時房東要給你設備清單(冰箱、冷氣、桌椅等),兩個人一起檢查確認。退租時你要照原樣還給房東,但正常使用的損耗(像牆壁自然褪色、地板輕微磨損)不用賠。所以簽約時一定要拍照記錄原況,退租才不會被冤枉。【AI起草,待驗收】",
    "violations": [
      {
        "pattern": "簽約時未提供設備清冊",
        "example": "房東沒給清單,退租時說「少了一張椅子」要扣押金3,000元,房客無法證明原本就沒有",
        "severity_flag": "中"
      },
      {
        "pattern": "清冊內容過於簡略",
        "example": "清冊只寫「家具若干」,沒列明細(桌子×1、椅子×4、冰箱×1),退租時爭議",
        "severity_flag": "中"
      },
      {
        "pattern": "簽約時未共同點交確認",
        "example": "房東自己檢查後給清單,房客沒一起確認,退租時房東說「冷氣本來是新的」要求賠償",
        "severity_flag": "中"
      },
      {
        "pattern": "要求房客賠償正常損耗",
        "example": "退租時房東要求「牆壁褪色重新粉刷費5,000元」,但這是2年正常使用的損耗",
        "severity_flag": "高"
      }
    ],
    "severity": "中",
    "source_ver": "114年4月18日"
  },
  {
    "id": "11",
    "type": "應記載",
    "original": "本租賃住宅之火災保險,由出租人投保。但租賃雙方另有約定者,從其約定。承租人另有投保住宅火災保險之必要者,得自行投保。",
    "plain": "房子的火災保險原則上房東要保。但你也可以自己保(保你自己的財物損失)。如果合約沒寫清楚誰保險,發生火災時財物損失可能沒人賠,所以要確認房東有沒有保。【AI起草,待驗收】",
    "violations": [
      {
        "pattern": "房東未投保火災保險",
        "example": "租屋處發生火災,房客損失10萬元財物,房東未投保也未約定由房客保,無法獲賠",
        "severity_flag": "高"
      },
      {
        "pattern": "合約約定由房客負擔保險費",
        "example": "房東要求房客支付每年3,600元火災保險費,但未明確記載於合約",
        "severity_flag": "中"
      },
      {
        "pattern": "保險責任約定不明確",
        "example": "合約只寫「保險事宜雙方協商」,未明確誰投保、保額多少,發生事故時爭議",
        "severity_flag": "中"
      }
    ],
    "severity": "中",
    "source_ver": "114年4月18日"
  },
  {
    "id": "12",
    "type": "應記載",
    "original": "因本契約發生之相關爭議或訴訟,雙方合意先經調解或仲裁程序,調解或仲裁不成立時,依中華民國法律處理,並以租賃住宅所在地之地方法院為第一審管轄法院。但不得排除消費者保護法第47條或民事訴訟法第436條之9小額訴訟管轄法院之適用。",
    "plain": "如果你和房東有糾紛,要先嘗試調解或仲裁,調解不成才打官司。訴訟要在租屋處所在地的法院進行。房東不能在合約寫「只能在台北地院告」來限制你的訴訟權利。【AI起草,待驗收】",
    "violations": [
      {
        "pattern": "排除調解或仲裁程序",
        "example": "合約寫「雙方直接訴訟,不得調解」,增加房客訴訟成本和時間",
        "severity_flag": "中"
      },
      {
        "pattern": "指定不利於房客的管轄法院",
        "example": "租屋在台中,合約卻寫「以台北地方法院為管轄法院」,房客訴訟成本大增",
        "severity_flag": "中"
      },
      {
        "pattern": "排除消費者保護法的適用",
        "example": "合約寫「本契約不適用消費者保護法」,企圖剝奪房客的法律保護",
        "severity_flag": "高"
      },
      {
        "pattern": "約定房客放棄訴訟權",
        "example": "合約寫「承租人不得對出租人提起訴訟」,嚴重侵害訴訟權",
        "severity_flag": "高"
      }
    ],
    "severity": "中",
    "source_ver": "114年4月18日"
  },
  {
    "id": "13",
    "type": "應記載",
    "original": "本契約其他約定事項:雙方得自行約定其他事項,但不得違反消費者保護法、住宅租賃契約應記載及不得記載事項及其他相關法令規定。",
    "plain": "合約可以有其他約定(比如能不能養寵物、能不能開伙),但不能違法。絕對不能有「不得遷入戶籍」「不得申報租金抵稅」「房屋稅由房客付」這些違法條款,寫了也無效。如果看到不合理的約定(像違約金超過1個月租金、限制你的自由),可以拒簽。【AI起草,待驗收】",
    "violations": [
      {
        "pattern": "限制承租人遷入戶籍",
        "example": "合約寫「承租人不得遷入戶籍」,這是不得記載事項,違法無效",
        "severity_flag": "高"
      },
      {
        "pattern": "禁止申報租金費用",
        "example": "合約寫「承租人不得申報租金抵稅」,違反不得記載事項",
        "severity_flag": "高"
      },
      {
        "pattern": "稅賦轉嫁給承租人",
        "example": "合約寫「房屋稅、地價稅由承租人負擔」,違反不得記載事項,應由房東負擔",
        "severity_flag": "高"
      },
      {
        "pattern": "違約金約定過高",
        "example": "合約寫「提前終止租約需賠償3個月租金45,000元」,超過法定1個月租金上限",
        "severity_flag": "高"
      },
      {
        "pattern": "限制承租人居住自由",
        "example": "合約寫「晚上11點後不得出入」「不得有訪客」等不合理限制,侵害居住自由",
        "severity_flag": "中"
      }
    ],
    "severity": "高",
    "source_ver": "114年4月18日"
  }
]
