[
  {
    "id": "24",
    "type": "不得記載",
    "original": "不得在租賃契約中預留『承租人應於租期內或租期終止時遷入或遷出戶籍』的默認條件",
    "plain": "房東不能在合約裡預先決定你的戶籍要不要跟著搬。戶籍遷入或遷出是你自己的選擇，房東沒有權力設定默認條件強制你必須遷入或遷出。",
    "violations": [
      {
        "pattern": "預留強制遷入戶籍條件",
        "example": "合約寫『承租人應於租期內將戶籍遷入本房屋』，房東無權這樣要求，此條款無效",
        "severity_flag": "高"
      },
      {
        "pattern": "預留強制遷出戶籍條件",
        "example": "合約寫『租期終止時承租人應無條件遷出戶籍』，此條款無效，房東無權強制要求",
        "severity_flag": "高"
      },
      {
        "pattern": "將戶籍條件與違約金綁定",
        "example": "合約寫『未按時遷出戶籍需賠償違約金』，此綁定條款無效，戶籍自主權不受影響",
        "severity_flag": "高"
      }
    ],
    "severity": "高",
    "source_ver": "114年4月18日",
    "status": "已驗收",
    "verification_notes": "2026-06-20 人類驗收通過"
  },
  {
    "id": "25",
    "type": "不得記載",
    "original": "不得在租賃契約中限制或指定承租人租金支付的地點",
    "plain": "房東不能強制你一定要在某個地點（比如銀行、超商或房東家裡）繳租。你可以選擇自己方便的方式和地點支付租金，房東不能禁止。",
    "violations": [
      {
        "pattern": "強制指定銀行帳戶繳租",
        "example": "合約寫『租金必須匯入房東指定帳戶』，房客可選擇其他支付方式，房東不能強制指定",
        "severity_flag": "高"
      },
      {
        "pattern": "強制親自交付現金",
        "example": "合約寫『承租人應親自到房東辦公室現金繳租』，房客可選擇其他方式，此限制無效",
        "severity_flag": "高"
      },
      {
        "pattern": "禁止代理人代繳",
        "example": "合約寫『租金不得由第三人代繳』，此限制無效，代理人代繳視為有效支付",
        "severity_flag": "高"
      },
      {
        "pattern": "額外服務費綁定支付地點",
        "example": "合約寫『在超商繳租需加收手續費100元』，此額外費用無效，房東不能因支付地點加費",
        "severity_flag": "高"
      }
    ],
    "severity": "高",
    "source_ver": "114年4月18日",
    "status": "已驗收",
    "verification_notes": "2026-06-20 人類驗收通過"
  },
  {
    "id": "26",
    "type": "不得記載",
    "original": "不得在租賃契約中禁止或限制承租人申報租金費用扣稅",
    "plain": "房東不能在合約禁止你申報租金來抵稅。申報租金扣稅是你的稅法權利，房東的禁止完全無效。即使房東威脅『申報就漲租』或要求你簽『不申報切結書』，這些都無法剝奪你的權利。",
    "violations": [
      {
        "pattern": "合約直接禁止申報",
        "example": "合約寫『承租人不得申報租金所得扣稅』，此條款無效，房客仍可依稅法規定申報",
        "severity_flag": "高"
      },
      {
        "pattern": "要求簽切結書放棄申報權",
        "example": "房東另外要求簽『承租人承諾不申報租金』切結書，此切結無法律效力，無法限制房客申報",
        "severity_flag": "高"
      },
      {
        "pattern": "威脅申報就漲租或終止租約",
        "example": "房東口頭說『你敢申報我就漲租』或『申報就趕你出去』，此威脅違反禁止性規定",
        "severity_flag": "高"
      },
      {
        "pattern": "設置申報稅務為解約條件",
        "example": "合約寫『如申報租金扣稅視為違約，需賠償違約金』，此綁定無效，房東不能以此為由解約",
        "severity_flag": "高"
      }
    ],
    "severity": "高",
    "source_ver": "114年4月18日",
    "status": "已驗收",
    "verification_notes": "2026-06-20 人類驗收通過"
  },
  {
    "id": "27",
    "type": "不得記載",
    "original": "不得在租賃契約中規定保證人代墊承租人租金",
    "plain": "房東不能在合約要求保證人幫房客墊租金。保證人的責任是『如果房客付不出租金，保證人要賠』，不是『保證人要先幫房客墊租金』。這是兩回事。",
    "violations": [
      {
        "pattern": "合約規定保證人主動代墊租金",
        "example": "合約寫『保證人應於房客遲延繳租時先行代為繳納』，此主動代墊義務無效，保證人只負擔保責任",
        "severity_flag": "中"
      },
      {
        "pattern": "設置保證人代墊為保證條件",
        "example": "合約寫『保證人同意代墊房客遲延之租金』，此條件無效，代墊與保證是不同責任",
        "severity_flag": "中"
      },
      {
        "pattern": "要求保證人簽署代墊保證書",
        "example": "房東另簽保證人代墊切結書，此切結無法律效力，不能將保證人變成代墊人",
        "severity_flag": "中"
      },
      {
        "pattern": "以代墊責任取代賠償責任",
        "example": "合約寫『保證人首先代墊，不足才賠償』，此順序無效，保證人只負賠償責任非代墊責任",
        "severity_flag": "中"
      }
    ],
    "severity": "中",
    "source_ver": "114年4月18日",
    "status": "已驗收",
    "verification_notes": "2026-06-20 人類驗收通過"
  },
  {
    "id": "28",
    "type": "不得記載",
    "original": "不得在租賃契約中要求承租人負擔房屋稅",
    "plain": "房東不能要求你付房屋稅。房屋稅是房東作為房屋所有人的責任，不能轉嫁給你。即使合約這樣寫也無效，你不用付。",
    "violations": [
      {
        "pattern": "直接要求房客承擔房屋稅",
        "example": "合約寫『承租人應負擔房屋稅』，此條款無效，房屋稅是房東的責任",
        "severity_flag": "高"
      },
      {
        "pattern": "將房屋稅列入租金或雜費",
        "example": "合約寫『月租金5,000元另含房屋稅900元』或『管理費含房屋稅』，此轉嫁無效",
        "severity_flag": "高"
      },
      {
        "pattern": "以房屋稅扣除押金或保證金",
        "example": "房東說『退租時用押金來抵房屋稅』，此扣除無效，房屋稅與押金無關",
        "severity_flag": "高"
      }
    ],
    "severity": "高",
    "source_ver": "114年4月18日",
    "status": "已驗收",
    "verification_notes": "2026-06-20 人類驗收通過"
  },
  {
    "id": "29",
    "type": "不得記載",
    "original": "不得在租賃契約中要求承租人負擔地價稅",
    "plain": "房東不能要求你付地價稅。地價稅是房東作為土地所有人的責任，不能轉給你。即使合約這樣寫也無效，你不用付。",
    "violations": [
      {
        "pattern": "直接要求房客承擔地價稅",
        "example": "合約寫『承租人應負擔地價稅』，此條款無效，地價稅是房東的責任",
        "severity_flag": "高"
      },
      {
        "pattern": "將地價稅列入租金或其他費用",
        "example": "合約寫『月租金5,000元另含地價稅500元』或『公共管理費含地價稅』，此轉嫁無效",
        "severity_flag": "高"
      },
      {
        "pattern": "以地價稅扣除租客的保證金或押金",
        "example": "房東說『退租時用押金來抵地價稅』，此扣除無效，地價稅與押金無關",
        "severity_flag": "高"
      }
    ],
    "severity": "高",
    "source_ver": "114年4月18日",
    "status": "已驗收",
    "verification_notes": "2026-06-20 人類驗收通過"
  },
  {
    "id": "30",
    "type": "不得記載",
    "original": "不得在租賃契約中賦予房東單方面解除租約的權利",
    "plain": "房東不能在合約裡寫『我隨時可以趕你出去』。除非法律明確允許（比如你嚴重違約），房東不能單方面終止租約。一旦簽了租約，房東就有義務讓你住到租期滿。",
    "violations": [
      {
        "pattern": "賦予房東無條件解約權",
        "example": "合約寫『房東可隨時終止本租約』或『房東得以書面通知終止租約』，此無條件權利無效",
        "severity_flag": "高"
      },
      {
        "pattern": "設置模糊理由讓房東單方終止",
        "example": "合約寫『房東認為房屋使用不當時可終止租約』，『認為』過於主觀，無法授予房東單方終止權",
        "severity_flag": "高"
      },
      {
        "pattern": "將房東單方終止權與其他條件綁定",
        "example": "合約寫『如房客未配合房東要求，房東得終止租約』，『要求』無明確定義，無法作為單方終止事由",
        "severity_flag": "高"
      },
      {
        "pattern": "預留短期終止條款規避法定程序",
        "example": "合約寫『租期內如房東需收回房屋，提前15天通知即可』，此為無條件單方終止，違反禁止規定",
        "severity_flag": "高"
      }
    ],
    "severity": "高",
    "source_ver": "114年4月18日",
    "status": "已驗收",
    "verification_notes": "2026-06-20 人類驗收通過"
  },
  {
    "id": "31",
    "type": "不得記載",
    "original": "不得在租賃契約中禁止承租人遷入戶籍",
    "plain": "房東不能在合約禁止你遷入戶籍。如果你需要把戶籍遷到租住的房子，房東無權禁止。即使合約寫『不得遷入戶籍』，這條也無效，你有權遷入。",
    "violations": [
      {
        "pattern": "直接禁止遷入戶籍",
        "example": "合約寫『承租人不得遷入戶籍』，此條款無效，房客有權根據自身需求遷入戶籍",
        "severity_flag": "高"
      },
      {
        "pattern": "設置遷入戶籍為違約條件",
        "example": "合約寫『如遷入戶籍視為違約，需賠償違約金』，此綁定無效，房東不能以遷入戶籍為由要求違約賠償",
        "severity_flag": "高"
      },
      {
        "pattern": "以未遷出戶籍扣除押金或罰款",
        "example": "房東說『租期滿還沒遷出戶籍，要扣押金』或『遷出才能領押金』，此扣除無效，戶籍狀態不能作為押金返還條件",
        "severity_flag": "高"
      }
    ],
    "severity": "高",
    "source_ver": "114年4月18日",
    "status": "已驗收",
    "verification_notes": "2026-06-20 人類驗收通過"
  },
  {
    "id": "32",
    "type": "不得記載",
    "original": "違約金之約定不得超過應賠償額之合理預估或月租金之一倍，超過部分無效",
    "plain": "房東的違約金有上限，最多只能罰你1個月的租金。如果合約寫『違約要賠2個月、3個月或更多』，超過1個月的部分完全無效，你可以拒付。",
    "violations": [
      {
        "pattern": "約定違約金超過月租金1倍",
        "example": "合約寫『承租人提前終止租約需賠償3個月租金45,000元』（月租15,000元），根據民法247條，超過1個月部分（30,000元）無效，實際最多賠15,000元",
        "severity_flag": "高"
      },
      {
        "pattern": "以百分比計算超額懲罰性違約金",
        "example": "合約寫『遲延繳租超過15天，罰款為月租金的50%作為違約金』，若超過1倍限制，超額部分無效",
        "severity_flag": "高"
      },
      {
        "pattern": "複雜梯級違約金結構規避監管",
        "example": "合約寫『提前30天終止：罰1.5倍、提前15天終止：罰2倍、突然終止：罰3倍』，全部超過1倍限制，全部超額部分無效",
        "severity_flag": "高"
      },
      {
        "pattern": "將多項違約綁定計算造成超額",
        "example": "合約寫『遲延繳租罰0.5倍+提前終止罰0.5倍+其他違約罰0.2倍』，若累計超過1倍，超過部分無效",
        "severity_flag": "高"
      }
    ],
    "severity": "高",
    "source_ver": "114年4月18日",
    "status": "已驗收",
    "verification_notes": "2026-06-20 人類驗收通過"
  },
  {
    "id": "33",
    "type": "不得記載",
    "original": "其他違反消費者保護法或民法規定、有顯著不公平情事或不符公平交易原則之條款",
    "plain": "合約中任何不公平、霸王條款，房東都不能寫進去。只要違反法律或對房客明顯不公平，即使合約寫了也無效。法律保護你不受欺負。",
    "violations": [
      {
        "pattern": "限制承租人出入時間",
        "example": "合約寫『房客只能在晚上22:00-隔日06:00出入』，違反房客自由使用權，此限制無效，房客有24小時出入權",
        "severity_flag": "高"
      },
      {
        "pattern": "限制訪客數量或時間",
        "example": "合約寫『每月訪客不得超過2次，訪客只能在週末來訪』，違反房客交友自由，此限制無效",
        "severity_flag": "高"
      },
      {
        "pattern": "強制購買房東指定物品或服務",
        "example": "合約寫『承租人應購買房東指定的家具、床墊、保險』，此強制購買無效，房客不能被強制消費",
        "severity_flag": "高"
      },
      {
        "pattern": "設置返還原狀費用以外的額外扣款",
        "example": "合約寫『退租時除返還原狀外另扣「清潔費」2,000元、「檢查費」1,000元』，額外費用無效，只能扣必要的原狀回復費",
        "severity_flag": "高"
      },
      {
        "pattern": "禁止房客更改房間布置或裝修",
        "example": "合約寫『承租人不得貼壁紙、釘釘子、改變房間布置』，過度限制房客合理使用權，此禁止無效",
        "severity_flag": "高"
      },
      {
        "pattern": "規定租期內不得申請退租",
        "example": "合約寫『租期一年，中途不得申請退租』，違反租客基本權利，此鎖定條款無效",
        "severity_flag": "高"
      },
      {
        "pattern": "要求房客負擔本應由房東承擔的修繕責任",
        "example": "合約寫『牆壁漏水、水管破裂等修繕費用由房客負擔』，此轉嫁無效，房東應負責結構性修繕",
        "severity_flag": "高"
      }
    ],
    "severity": "高",
    "source_ver": "114年4月18日",
    "status": "已驗收",
    "verification_notes": "2026-06-20 人類驗收通過"
  }
]
